link,duration,title,source,author
https://www.instagram.com/reel/DW16FkXDHnu/,0:59,There are so many supplements out there but here's the truth ...,Instagram,Nutritionist | Menopause | Personal Trainer
https://www.instagram.com/reel/DW1wEafhAEe/,0:04,"Most women aren't lacking effort, they're lacking clarity. In ...",Instagram,menopauserebels
https://www.instagram.com/reel/DW2SdDGPQOB/,1:03,Which supplements/hacks work best for these ...,Instagram,Elevate MD
https://www.instagram.com/reel/DW3XggCCtqW/,0:09,"Promensil on Instagram: ""Are you due for a Menopause reset ...",Instagram,Promensil
https://www.instagram.com/reel/DW3_zIrjFZe/,0:10,Just one heaped scoop of Peachie toppings (20g) adds a ...,Instagram,Peachie | Nutrition for Menopause & Wellness Community
https://www.instagram.com/reel/DW4T4DUiiYP/,1:02,"Karen Newby on Instagram: ""Supplement #1 Rummage ...",Instagram,Karen Newby
https://www.instagram.com/reel/DW4eWU7DBmU/,0:25,vitamins refill time! I'm using nutrition geeks menopause ...,Instagram,wkd queen
https://www.instagram.com/reel/DW4eWU7DBmU/?hl=bg,0:25,vitamins refill time! I'm using nutrition geeks menopause ...,Instagram,wkd queen
https://www.instagram.com/reel/DW4fJYJESfZ/,1:09,Perimenopause and menopause change the gene for ...,Instagram,Andrea A Forsythe
https://www.instagram.com/reel/DW5uhoPDOir/,0:21,Can supplements help manage the symptoms of ...,Instagram,Arth
https://www.instagram.com/reel/DW6FA-ODISq/,2:40,"Women's health supplements on Instagram: ""Guess what ...",Instagram,Binto | Women’s health supplements
https://www.instagram.com/reel/DW6TX9vzYHn/,0:57,Estrogen decline after 40 feels like this It is real and it shows ...,Instagram,PharmEasy App
https://www.instagram.com/reel/DW6oZCtEs7X/,0:23,Menopause support! #Supplements #menopause,Instagram,CoachJulie_thefooddoc
https://www.instagram.com/reel/DW79Nk8jand/,1:26,Many people don’t know this side effect from GLP-1s… and it’s ...,Instagram,Hair Culture Day Spa | South Florida Salon
https://www.instagram.com/reel/DW7qknkjy6v/,1:34,Ask A Nurse - Things To Know When Getting Perimenopause ...,Instagram,Nurse_Dezi
https://www.instagram.com/reel/DW8qt3NEvvl/,0:08,Which supplements should I take after 35?” This is a very ...,Instagram,Dr. Priyakshi | Gynecologist & Fertility Expert
https://www.instagram.com/reel/DW94p1xEvwh/,0:35,"Some say, “that's a lot of supplements” . I'm 57, post ...",Instagram,Dawn Parsons | Midlife Style
https://www.instagram.com/reel/DW9BSfzkZ9r/,0:05,Bone loss is one of the most silent and underdiagnosed ...,Instagram,Dr. Ben Gonzalez | Medical Feminist
https://www.instagram.com/reel/DW9ObJnFUmO/,1:52,Why supplements work for some women and doesn't for ...,Instagram,thebridgesystem
https://www.instagram.com/reel/DW9_TS3E35v/,0:45,Toronto Dermatology Centre | Here are 3 simple ways to ...,Instagram,Centre
https://www.instagram.com/reel/DWAYxLRjpZY/,1:13,Any women 45+ I found a menopause multivitamin that helped ...,Instagram,Emily-HOME WORKOUTS FOR ALL FITNESS LEVELS
https://www.instagram.com/reel/DWEteAEjKDv/,1:39,My Wife's Menopause Supplement Routine ...,Instagram,Dr. Daniel Pompa
https://www.instagram.com/reel/DWFrNWrE-56/,0:37,Ask your doctor for evidence-based options. Mention ...,Instagram,"Dr. Erica Jones, MD | Family Medicine"
https://www.instagram.com/reel/DWI83Chkas1/,0:51,Don't introduce all new vitamins at once! My advice? Ease in ...,Instagram,Bryan Stratte
https://www.instagram.com/reel/DWMHUwktXQl/,0:44,"Marks & Spencer Style on Instagram: ""The power duo to bring ...",Instagram,Marks & Spencer Style
https://www.instagram.com/reel/DWOl4YNiDbM/,0:47,Only two remains .... 50000 each,Instagram,khairat ndassiwa
https://www.instagram.com/reel/DWPY---kTbF/,0:59,Excited to try my new gifted night time supplements from ...,Instagram,Kaya Herstad Carney
https://www.instagram.com/reel/DWQBUcqiOFs/,1:36,10 Essential supplements for menopause you didn't know you ...,Instagram,Mr AI Videos 📹
https://www.instagram.com/reel/DWRyilZuKvL/,0:28,"Menopause is a natural phase, but managing the symptoms ...",Instagram,Rothercare pharmacy
https://www.instagram.com/reel/DWSfZpSCjtG/,0:17,Talk to your doctor about any supplements you're taking. They ...,Instagram,"Dr. Erica Jones, MD | Family Medicine"
https://www.instagram.com/reel/DWT5jQojI7P/,0:11,Best 5 Vitamins Every Woman Should Take During ...,Instagram,Dr. Godric Fit
https://www.instagram.com/reel/DWUT_X_jPoh/,2:59,So the Advertising Standards Association has taken 5 ...,Instagram,Fiona Clark
https://www.instagram.com/reel/DWV1SJ4gEIR/,0:48,Vitamins and what they do for you: Perimenopause vitamins ...,Instagram,MOODY MONTH
https://www.instagram.com/reel/DWW9Rkdj7Gr/,0:59,I thought I was doing everything right with my vitamins. I knew I ...,Instagram,Carole Jones | Social Media Coach
https://www.instagram.com/reel/DWWSDMRgR1w/,2:58,Dr. Ruth Dottin | What are some supplements that can be ...,Instagram,Dr. Ruth Dottin
https://www.instagram.com/reel/DWWsuqSCLr8/,1:23,Issviva ambassador Mandy is back to give us an update on ...,Instagram,Issviva
https://www.instagram.com/reel/DWXDW_Qkrvl/,2:40,Robert W.B. Love | This Supplement is So Good for Women ...,Instagram,Robert W.B. Love
https://www.instagram.com/reel/DWXrplkCJzc/,0:18,Vitamins and Minerals for Menopause Health Vitamin D & ...,Instagram,Lapaulla wellness
https://www.instagram.com/reel/DWZJZQWj7Fy/,0:19,Hot flashes? Low energy? Mood swings? You don't have to ...,Instagram,Gift Aguh
https://www.instagram.com/reel/DWZNGkoiMpn/,0:34,Women's health matters at every stage — including ...,Instagram,Market Street Pharmacy
https://www.instagram.com/reel/DW_wfvdAoCd/,0:24,Peri-menopause (the symptomatic years leading up to ...,Instagram,The Green Door Life: Nutrition Coaching & Strength Training
https://www.instagram.com/reel/DWbNip9kdiI/,0:09,Choosing wellness products that truly feel tailored to you starts ...,Instagram,Peak Vitamins
https://www.instagram.com/reel/DWbWhTSywkG/,0:52,I kept wondering what was wrong with me Hot flashes ...,Instagram,Allka Phutelaa | Dietitian | Healthy lifestyle
https://www.instagram.com/reel/DWbblnpTr_v/,0:22,Menopause ke dauran body me kaafi changes aate hain Isliye ...,Instagram,Mani Mudgal
https://www.instagram.com/reel/DWe4ZeFEmIS/,0:37,Not all supplements are created equal. Here's what's actually ...,Instagram,Candace Wilson Schoeff
https://www.instagram.com/reel/DWeTDGlDHtX/,0:26,"Feeling low energy, brain fog or just off? #lowenergy #energy ...",Instagram,Bobbi Wekenmann Rung
https://www.instagram.com/reel/DWfMMqggWmm/,0:05,Boost calcium & vitamin D. These nutrients are key for bone ...,Instagram,Menopause Treatment Clinic
https://www.instagram.com/reel/DWfgs02kzNV/,0:55,Spending nearly $500 on supplements a month and still not ...,Instagram,gisbarbados
https://www.instagram.com/reel/DWg86PfD6iP/,0:43,Spring is here! And seasonal transitions can sometimes ...,Instagram,Appell&Sorrell Wellness
https://www.instagram.com/reel/DWgrCesCq44/,1:44,"Nutritionist on Instagram: ""Menopause being talked about ...",Instagram,Sam Jones | Nutritionist
https://www.instagram.com/reel/DWixSE6AoQK/,0:42,Stop right now… we've got news @officialmelb has joined ...,Instagram,Holland & Barrett
https://www.instagram.com/reel/DWkWc5xjec_/,1:17,Do you know the benefits of vitamin E? #menopause ...,Instagram,Sylvie Tchuindjo
https://www.instagram.com/reel/DWlZX5fDZI3/,1:16,Menopause comes with its own set of challenges from low ...,Instagram,Dr Nicolette van Zyl
https://www.instagram.com/reel/DWmmppTkw8D/,0:37,The menopause supplement industry is lying to you. Not ...,Instagram,Dr. Tracy Verrico
https://www.instagram.com/reel/DWnClzVjWHp/,0:05,As a naturopath I utilise supplements as a clinical tool. They ...,Instagram,Women’s Health Clinical Naturopath | Kassandra Peterson
https://www.instagram.com/reel/DWnUHCWiK4n/,2:42,Perimenopause and menopause can bring a whirlwind of ...,Instagram,Television Jamaica/Radio Jamaica News Centre
https://www.instagram.com/reel/DWnePXTiuEI/,0:20,Menopause Supplements: What Do You Actually Need? The ...,Instagram,SY Menopausesolutions
https://www.instagram.com/reel/DWnlIWdInM-/,0:09,Collagen is part of my basic menopause supplement protocol ...,Instagram,Karen Newby
https://www.instagram.com/reel/DWo0nDQACPQ/,0:08,Comment SUPPS and I'll send you my go-to perimenopause ...,Instagram,christina watkins
https://www.instagram.com/reel/DWoySGUjViC/,0:08,Comment SUPPS and I'll send you my go-to perimenopause ...,Instagram,Christina | Nutritionist + Hormone Health Expert
https://www.instagram.com/reel/DWozLEgiXMt/,2:21,More women are experiencing perimenopause and ...,Instagram,Julia T Hunter MD
https://www.instagram.com/reel/DWpe9rqjT_9/,0:22,When And How To Take Your Supplements For The Best ...,Instagram,"Abbey Walsh, MS, CNS, LDN"
https://www.instagram.com/reel/DWpqQEFEZA3/,0:50,"Exclusive! #73 Menopause, MHT, testosterone, Vaginal ...",Instagram,The Curbsiders
https://www.instagram.com/reel/DWrY-vDCf63/,1:11,"Rheal on Instagram: ""Introducing Balance Tonic Menopause ...",Instagram,Rheal
https://www.instagram.com/reel/DWrsJUrEZFW/,1:44,"Medexplained on Instagram: ""Not all supplements for ...",Instagram,Medexplained
https://www.instagram.com/reel/DWs9v9KioQT/,0:54,top 5 foundational supplements for perimenopause ...,Instagram,Slender Me Medical
https://www.instagram.com/reel/DWsCtfrkRJ4/,1:17,Save & Share this list of SUPPLEMENTS that work against ...,Instagram,Fat Loss & Mindset Coaching for Busy Professional Women 30+
https://www.instagram.com/reel/DWt6QA7FJ2T/,0:45,If you missed the webinar Supplements: Why and How to Take ...,Instagram,Pomroy
https://www.instagram.com/reel/DWtDYs_t_q4/,0:41,If I had to recommend just one supplement for many women in ...,Instagram,Meera Bhogal Women’s Health & Menopause Coach
https://www.instagram.com/reel/DWtfgJfjUVf/,0:49,Comment YES for the link before this price is gone! Women ...,Instagram,CJ
https://www.instagram.com/reel/DWty1LclL6d/,1:23,In Latia Hickerson's Menopause in Motion course session on ...,Instagram,Women’s Health NPs
https://www.instagram.com/reel/DWuEBbZEVTq/,1:00,Menopause essentials #menopause ...,Instagram,Chanelle Marshbank
https://www.instagram.com/reel/DWvOjl2DMdV/,1:22,"Soha | I’ve never really been a morning person, more a “don’t ...",Instagram,Soha
https://www.instagram.com/reel/DWvbnU0DTZQ/,2:41,"SIP on Instagram: ""SIP Happens And for many of us going ...",Instagram,SIP
https://www.instagram.com/reel/DWwPG4ejDXj/,3:00,Let's talk VITAMINS and perimenopause! I take both morning ...,Instagram,Lissette
https://www.instagram.com/reel/DWx2qYQE0I2/,1:17,Osteoporosis: Silent Weakening of Bones ⚠️ Osteoporosis ...,Instagram,Dhruva hospital
https://www.instagram.com/reel/DWyfvwZiF6Y/,0:35,Do not over complicate your menopause supplement routine ...,Instagram,Menopause Vitamin Company
https://www.instagram.com/reel/DWz71KgEfbS/,1:36,Is creatine just for bodybuilders? Not quite! Emerging research ...,Instagram,Stephanie Trentacoste McNally
https://www.instagram.com/reel/DWzmXjrBfzN/,2:00,"Menopause & Women's Health Educator on Instagram: ""When ...",Instagram,Dr. Cat Brown | Menopause & Women’s Health Educator
https://www.instagram.com/reel/DXAPS5-kfFc/,0:12,Menopause never looked this good. Comment MENO to read ...,Instagram,David Roberts @ The Mara Labs
https://www.instagram.com/reel/DXAlT2FEeSS/,0:16,This menopause wellness supplement supports your body ...,Instagram,Her Solace
https://www.instagram.com/reel/DXBP6MnDPei/,1:00,"SIP on Instagram: ""SIP Happens, and one of the biggest ...",Instagram,SIP
https://www.instagram.com/reel/DXBPWcygU8L/,1:06,The global menopause market was valued at $17.8 billion in ...,Instagram,Female Founder World
https://www.instagram.com/reel/DXCDGNFEgSm/,1:40,"The Shaili Chopra Show on Instagram: ""At The Shaili Chopra ...",Instagram,The Shaili Chopra Show
https://www.instagram.com/reel/DXD3ycGjsUP/,0:19,Most women are in perimenopause for years before they ...,Instagram,"Tamsen Fadal, author How To Menopause"
https://www.instagram.com/reel/DXD51JrioXs/,0:39,PERI-MENOPAUSE MORNING TONIC (WITH CREATINE ...,Instagram,Chinu/ Shilarna Vaze
https://www.instagram.com/reel/DXDDBqaEatB/,2:06,"Ourself on Instagram: ""Did you know that women can lose up ...",Instagram,Ourself
https://www.instagram.com/reel/DXDPGi0E52a/,0:24,"Unpopular opinion: You can't out-supplement, out-peptide, or ...",Instagram,Kimberley Bruce | Menopause Strength Coach for Women 40+
https://www.instagram.com/reel/DXDaFuYky6f/,0:24,"Unpopular opinion: You can't out-supplement, out-peptide, or ...",Instagram,Kimberley Bruce | Menopause Strength Coach for Women 40+
https://www.instagram.com/reel/DXDawuOD35g/,0:06,"Women over 40, this is one supplement I get asked about all ...",Instagram,Shannon Hanson | Women's Fitness & Transformation Coach
https://www.instagram.com/reel/DXDc6Fhl-VY/,1:07,"After her hysterectomy and entering menopause, Dr. Juliana ...",Instagram,Qualia Life
https://www.instagram.com/reel/DXDer9ORH6M/,2:11,What is PCOS (polycystic ovarian syndrome)? It's a condition ...,Instagram,Barbara O’Neill
https://www.instagram.com/reel/DXDrySTkkcP/,0:22,Collagen banking is tiny investments you make over the ...,Instagram,Vasudha Rai 🧿
https://www.instagram.com/reel/DXE2SL3ErQB/,0:28,Saving lives by day… stealing the spotlight by night ‍⚕️ ...,Instagram,Dr. Priyakshi | Gynecologist & Fertility Expert
https://www.instagram.com/reel/DXE4Oq-gWuT/,0:46,Weight gain after 40? It's not just your diet — it's your ...,Instagram,Nandita Palshetkar
https://www.instagram.com/reel/DXE5tRwkePp/,0:06,Wow. I am a completely different person. I just got back from a ...,Instagram,Hormonal Health Coach for Women 30+
https://www.instagram.com/reel/DXEGBqbiMp2/,0:32,"As we age, feeling weaker or having fragile bones is often ...",Instagram,Stavya Spine Hospital & Research Institute
https://www.instagram.com/reel/DXEIrJcCFzx/,0:10,"Common symptoms like hair loss, fatigue, brain fog, and cold ...",Instagram,medico_ahm
https://www.instagram.com/reel/DXENZ5TDfrH/,0:05,Omolara Aiyenimelo !! Skincare Products & Supplements in ...,Instagram,Omolara Aiyenimelo !! Skincare Products & Supplements in Abuja
https://www.instagram.com/reel/DXEPq71Eral/,2:00,"Peptides, supplements, powders… don't just take it because ...",Instagram,Clinica Lase
https://www.instagram.com/reel/DXEauMHEW2L/,0:14,If your treatments have stopped working… this is why ...,Instagram,JoElle Lee | Skin of Color Expert
https://www.instagram.com/reel/DXEjueWguoO/,0:23,5 benefits shatavari ke female hormones par #pcos #pcos ...,Instagram,NaariHealth By Dr Leepika
https://www.instagram.com/reel/DXElVIbDGXk/,0:46,Nobody prepares you for how much menopause can change ...,Instagram,Sahir Ahmed-Evans | Women’s Health Speaker | Educator | Advocate
https://www.instagram.com/reel/DXEtKppjrxc/,0:37,Taraneh Shirazian | When should women start screening for ...,Instagram,Taraneh Shirazian
https://www.instagram.com/reel/DXF2UFfjS2M/,0:08,𝗖𝗿𝗲𝗮𝘁𝗶𝗻𝗲 𝗶𝘀 𝗻𝗼𝘁 𝗮 “𝗴𝘆𝗺 𝘀𝘂𝗽𝗽𝗹𝗲𝗺𝗲𝗻𝘁.” 𝗜𝘁’𝘀 𝗮 ...,Instagram,𝙇𝙀𝙓𝙄 𝙔𝙊𝙊 𝙉𝙋👩🏻‍⚕️IFMCP
https://www.instagram.com/reel/DXF6_p4TXMK/,0:08,You can't out-supplement UV damage. I'm 43 with a genetic ...,Instagram,Magdalene (Maggie) Rose 🌸
https://www.instagram.com/reel/DXFAPWNiF8-/,1:45,So I shared this ( incomplete) in stories and a few women ...,Instagram,Abi Daré
https://www.instagram.com/reel/DXFCe_Wjk8-/,0:05,"Not every symptom means you have a nutrient deficiency, but ...",Instagram,Health
https://www.instagram.com/reel/DXFEwAkE_Rf/,0:49,Over 50 and not taking estrogen? These supplements matter ...,Instagram,Lisa Anne King
https://www.instagram.com/reel/DXFKSZVio0i/,0:05,Here 1️⃣ Perimenopause and menopause hormone shifts ...,Instagram,"Rey Hamidi, MD"
https://www.instagram.com/reel/DXFKhJiDrjy/,2:55,let me fix your HRT! #hormonetherapy #hormonehealth ...,Instagram,Heather Hirsch MD | Perimenopause & Middle-Life Expert
https://www.instagram.com/reel/DXFY3mRDj2y/,0:07,Most women are told menopause is just hormonal. But your ...,Instagram,Vivian Asamoah
https://www.instagram.com/reel/DXFaxnQgWuz/,0:52,#ad Thought it was stress… turns out it was perimenopause ...,Instagram,"Tiffany Ishiguro - fashion, mom, lifestyle 📍SEATTLE"
https://www.instagram.com/reel/DXFb8N8EYkr/,0:57,Menopause should absolutely be part of the conversation. But ...,Instagram,"Dr. Nikitha Paluri, MD"
https://www.instagram.com/reel/DXFgRfKESAk/,0:50,"Today I want to share something very simple, but something ...",Instagram,Anita Lauren
https://www.instagram.com/reel/DXFgVNRlMVg/,0:56,"Creatine isn't just for athletes, it plays a key role in brain ...",Instagram,Candace Wilson Schoeff
https://www.instagram.com/reel/DXFnEZUEZiA/,1:00,#adComment MENO for a link and a discount code ...,Instagram,Katie Duke | Nurse Practitioner & Creator
https://www.instagram.com/reel/DXGDi2wCfXS/,0:11,Creatine isn't magic. It doesn't burn fat. It doesn't bulk women ...,Instagram,Shanti
https://www.instagram.com/reel/DXGJke7CYVu/,1:20,Can we talk about the superfood of superfoods? Beets. One of ...,Instagram,Green Candy
https://www.instagram.com/reel/DXGOkqVPX6t/,1:25,Menopause Symptoms Every Woman Must Know #pcos ...,Instagram,Lakshmi Narayana
https://www.instagram.com/reel/DXGjvDkCM87/,0:55,Menopause supplements- do you really need them? it is a ...,Instagram,Aly Khairuddin
https://www.instagram.com/reel/DXH37PNDNKy/,0:52,THESE MISTAKES ARE KILLING YOUR PROBIOTICS ...,Instagram,Dylan Conrad - Women’s Fat Loss Coach
https://www.instagram.com/reel/DXH9eVEkueA/,2:10,If you're a mom with headaches… you've probably been told ...,Instagram,Delia Tuttle DDS
https://www.instagram.com/reel/DXHAgflEuCk/,0:32,Birth control pills are not just for contraception. . For some ...,Instagram,Heather Hirsch MD | Perimenopause & Middle-Life Expert
https://www.instagram.com/reel/DXHEpjggF6_/,2:17,"Stop playing ""Whack-a-Mole"" with your health. Taking high ...",Instagram,"Malea Jensen, DO/Family Doctor & Health Tips"
https://www.instagram.com/reel/DXHJ6cclmFw/,1:29,Calcium & Vitamin D – How Much Do You Really Need ...,Instagram,Asian Spine Hospital
https://www.instagram.com/reel/DXHJX3HEZVV/,1:16,"In your 40s, collagen loss can speed up dramatically up to 30 ...",Instagram,Dr. Aleksandra Brown | Board Certified Dermatologist
https://www.instagram.com/reel/DXHO36WjTIT/,1:09,Stop wasting money on supplements if you haven't done the ...,Instagram,Larimar Med Spa by Dr. Lauren Fitz
https://www.instagram.com/reel/DXH_KuTEu6R/,0:32,Perimenopause doesn't start on a birthday. It starts with ...,Instagram,Equelle
https://www.instagram.com/reel/DXHfy6kkmk5/,0:23,Menopause & anti-inflammatory nutrition workshop recap ...,Instagram,Lite Clinic | Mirna El Murr
https://www.instagram.com/reel/DXHpjx4gDW3/,0:04,Karla Salinari | Latina Nutritionist | These are the ONLY 3 ...,Instagram,Karla Salinari | Latina Nutritionist
https://www.instagram.com/reel/DXIC36iESdG/,0:28,I asked Dr. Mary Claire Haver about the importance of ...,Instagram,Post Run High
https://www.instagram.com/reel/DXIEEQsApIz/,2:13,If you're a mom with headaches… you've probably been told ...,Instagram,Delia Tuttle DDS
https://www.instagram.com/reel/DXIOdRZgHgl/,1:22,Abnormal uterine bleeding can occur after a joint injection or ...,Instagram,Jocelyn Wittstein
https://www.instagram.com/reel/DXITDWmj2bd/,1:21,Comment GRUNS and I will send you my link for up to 52% off ...,Instagram,Samantha Mullino
https://www.instagram.com/reel/DXIWx6sErQr/,0:23,Have you ever just not felt like yourself during menopause ...,Instagram,"Tamsen Fadal, author How To Menopause"
https://www.instagram.com/reel/DXIbUfSgr4i/,0:34,You give your best energy to everyone else… and live off ...,Instagram,Stephanie Crassweller | Menopause + Hormone Coach
https://www.instagram.com/reel/DXIlXv2kfuN/,0:21,"If your brain feels slower, foggier, or just off lately… you're not ...",Instagram,NuEthix Formulations
https://www.instagram.com/reel/DXImklFgSXy/,0:21,Being on chemo means when I'm dragging I need a kick to my ...,Instagram,Teri Market
https://www.instagram.com/reel/DXIp03yDbfF/,1:04,A new episode of Modern Menopause is OUT TODAY Ep 4 ...,Instagram,Kate at Parlor Games
https://www.instagram.com/reel/DXIuRDrDr56/,1:47,Follow me for more health content based in the USA!❤️ ⬇️ ...,Instagram,Sarah Hong
https://www.instagram.com/reel/DXJ2v0qgDAN/,0:10,Creatine is a natural compound your body already makes ...,Instagram,Sadie Rigby | STRENGTH TRAINING
https://www.instagram.com/reel/DXJ3OLjiimT/,0:18,#menopause #perimenopause #hrt #womenshealth ...,Instagram,Noor Al-Humaidhi MD
https://www.instagram.com/reel/DXJAqZ9iJRZ/,1:46,Understanding your own hormonal balance is crucial as you ...,Instagram,"Tanvi Parikh | Fitness, Mindset & Nutrition"
https://www.instagram.com/reel/DXJYECggntO/,0:15,"Supplements often get treated like harmless insurance, but ...",Instagram,Prevention Magazine Australia
https://www.instagram.com/reel/DXJqVikkWJ6/,0:41,"Get ready with me! Linking everything from my skincare, my ...",Instagram,Jordan Arcila (Edwards)
https://www.instagram.com/reel/DXJzmaliOAr/,0:31,@DrBettyMurray explains the relationship between lower ...,Instagram,Menopause Energy Bars
https://www.instagram.com/reel/DXK3XJLjyDO/,0:48,Week five of one change and I would've been on supplement ...,Instagram,SNiP Nutrigenomics
https://www.instagram.com/reel/DXK4UezDskb/,0:33,3 drops. 3 times a day. 5 seconds. That's the whole routine. If ...,Instagram,Forefront Health
https://www.instagram.com/reel/DXK5B5_E-9-/,0:47,If you wake at 3am like clockwork and feel wired but ...,Instagram,Dr. Mia Chorney
https://www.instagram.com/reel/DXK840uCtIp/,0:35,Choosing changes that make me feel good! AD Adding ...,Instagram,Deborah Bitton
https://www.instagram.com/reel/DXKHL5-ilT3/,0:52,There was one day a month where I felt rage. Not frustration ...,Instagram,Movement Co.
https://www.instagram.com/reel/DXKPdHAiOS1/,0:16,https://youtube.com/shorts/8Pw2slmMS9Q?si=GvPmkknQ ...,Instagram,DocMediHealth
https://www.instagram.com/reel/DXKRVjFgkEh/,0:20,Not me casually entering menopause like it's a promotion ‍♀️ ...,Instagram,Cody Sanders
https://www.instagram.com/reel/DXKRxTAgHNj/,0:30,"FOUND on Instagram: ""If it feels harder to maintain your ...",Instagram,FOUND
https://www.instagram.com/reel/DXKU6-rieXn/,1:16,If you're a woman in your 40s 50s are beyond you're probably ...,Instagram,Dr. Amy Shah
https://www.instagram.com/reel/DXKWmIkjqMb/,2:17,So many women feel “off” and don't realize why…on this walk ...,Instagram,Kate Mackz
https://www.instagram.com/reel/DXKcYpigZpG/,0:56,Now Available -- The Positive Pause® Episode 42 ...,Instagram,National Menopause Foundation
https://www.instagram.com/reel/DXKgHUiEkaW/,0:17,A supplement designed to support women's nutritional needs ‍ ...,Instagram,Advanced Functional Medicine
https://www.instagram.com/reel/DXKlcjGEUcy/,1:17,Strong is cute… but strong with support is even better Ladies ...,Instagram,Claudia Van Schalkwyk
https://www.instagram.com/reel/DXL2mgUBRE2/,0:39,"Let's be honest. Menapause sucks! I mean, as if us women ...",Instagram,Skin Therapy Clinic Brisbane
https://www.instagram.com/reel/DXLAo6SjOZ3/,1:16,Creatine helps support muscle mass. It may also help during ...,Instagram,"Dr. Nikitha Paluri, MD"
https://www.instagram.com/reel/DXLAw22E7ND/,0:15,AUTUMN NESTING BLACK BOX⁠ ⁠ ⁠ ⁠The Remifemin ...,Instagram,Black Box NZ
https://www.instagram.com/reel/DXLF9KeAB5K/,0:17,"Direct Chemist Outlet on Instagram: ""Meet the new Bioglan ...",Instagram,Direct Chemist Outlet
https://www.instagram.com/reel/DXLFvX-jeQM/,1:09,Incorporating @WonderBiotics into my routine has truly been ...,Instagram,Amy Macedo
https://www.instagram.com/reel/DXLGCO7jMaU/,0:43,Magnesium for Sleep in Menopause: The Missing Link to ...,Instagram,pauzhealth
https://www.instagram.com/reel/DXLM5JsmgxT/,2:13,WORKING OUT + EATING CLEAN BUT ALCOHOL SETS YOU ...,Instagram,Dylan Conrad - Women’s Fat Loss Coach
https://www.instagram.com/reel/DXLxUS8kr0T/,1:47,Comment POI PROTOCOL for a link to read my latest substack ...,Instagram,Hormone Health Studio
https://www.instagram.com/reel/DXM0f5QjDz7/,0:47,Here are 7 of the most important vitamins (and key nutrients ...,Instagram,Pharm truth
https://www.instagram.com/reel/DXM10UijAqv/,0:55,3 supplements for women in menopause #menopause ...,Instagram,Dr Alba Pereira | Menopause Specialist
https://www.instagram.com/reel/DXM1CycgvRv/,0:43,"Formulated by me, based on the latest ingredient research in ...",Instagram,Jessie Inchauspé
https://www.instagram.com/reel/DXM3XeSjpo8/,0:14,"#PressPlay: #TSRHealth—Roomies, how are you taking the ...",Instagram,The Shade Room
https://www.instagram.com/reel/DXMs4gqADG2/,1:04,Axia Women’s Health | Not sure which prenatal vitamin to ...,Instagram,Axia Women’s Health
https://www.instagram.com/reel/DXMzrPzjBxE/,0:40,Are you menopausal or you need to know how to take your ...,Instagram,"ABUJA MEDSPA , UK CERTIFIED AESTHETICIAN & ADVANCED TREATMENTS"
https://www.instagram.com/reel/DXN2LjoCbR7/,0:17,Low Libido Isn't “Normal Aging” Most women are told to either ...,Instagram,Soma Clinic | Women’s Health SG
https://www.instagram.com/reel/DXNBqWkDGAR/,1:50,MENOPAUSAL AS F*CK AND STILL NOT LOSING FAT And ...,Instagram,Dylan Conrad - Women’s Fat Loss Coach
https://www.instagram.com/reel/DXNVx5WTMIJ/,1:34,As you move through the later stages of perimenopause ...,Instagram,Dr. Cat Brown | Menopause & Women’s Health Educator
https://www.instagram.com/reel/DXNZjRwk133/,0:09,Say it with us…protein protein protein #hellohealth ...,Instagram,Hello Health
