link,duration,title,source,author
https://www.tiktok.com/@heatherhirschmd/video/7107301852475231534,0:52,Painful Intercourse? Menopause & Vaginal Estrogen,TikTok,heatherhirschmd
https://www.tiktok.com/@heatherhirschmd/video/7155584332059397422,0:54,Managing Perimenopause Symptoms with Birth Control Pills,TikTok,heatherhirschmd
https://www.tiktok.com/@heatherhirschmd/video/7192286160855518510,0:53,Understanding Perimenopause Symptoms and Birth Control ...,TikTok,heatherhirschmd
https://www.tiktok.com/@heatherhirschmd/video/7224188532288523563,0:54,Tips to Reduce Menopausal Bloating,TikTok,heatherhirschmd
https://www.tiktok.com/@heatherhirschmd/video/7376395452394048799,0:57,Replying to @MLO do you see a difference in brand vs ...,TikTok,heatherhirschmd
https://www.tiktok.com/@heatherhirschmd/video/7506627841040076078,0:58,Managing Luteal Phase Symptoms with Estrogen Support,TikTok,heatherhirschmd
https://www.tiktok.com/@heatherhirschmd/video/7558150952340049207,0:43,Estrogen Side Effects During Menopause Explained,TikTok,heatherhirschmd
https://www.tiktok.com/@heatherhirschmd/video/7628252260685860109,2:29,"Divigel backorders can be so frustrating, especially when you ...",TikTok,heatherhirschmd
https://www.tiktok.com/@helenhomestylespace/video/7614942600130219286,0:47,Effective Red Clover Supplement for Menopause Relief,TikTok,helenhomestylespace
https://www.tiktok.com/@her_biotics/video/7620389045931134209,1:20,Her-Biotics: Gut Health & Hormone Balance for Women,TikTok,her_biotics
https://www.tiktok.com/@heyshantaqtv/video/7628634016782093598,0:59,Invest in yourself #tiktokmademebuylt | Invest In Yourself,TikTok,heyshantaqtv
https://www.tiktok.com/@heyshantaqtv/video/7628701059032042782,1:22,ShantaQuilette (@heyshantaqtv)’s video of perimenopause ears,TikTok,heyshantaqtv
https://www.tiktok.com/@heyshantaqtv/video/7630446536412908830,0:42,What’s up Montgomery; Alabama ...,TikTok,heyshantaqtv
https://www.tiktok.com/@hiddengemscandi/video/7610586073013488909,0:33,Totaria 40-in-1 Menopause Supplements for Complete ...,TikTok,hiddengemscandi
https://www.tiktok.com/@higherupwellness/video/7376780866732723502,1:27,Best Magnesium Supplement for Cognitive Health and ...,TikTok,higherupwellness
https://www.tiktok.com/@higherupwellness/video/7630154649911168286,1:00,Huge magnesium guy. | magnesium glycinate,TikTok,higherupwellness
https://www.tiktok.com/@historiascompleta005/video/7610451194888080653,0:26,Peach Perfect Menopause Multi: Your Essential Supplement,TikTok,historiascompleta005
https://www.tiktok.com/@hmtmart/video/7522848621297978638,0:22,Happy Mammoth Meno Daily Menopause Vitamins & ...,TikTok,hmtmart
https://www.tiktok.com/@holistichealthrobin/video/7627295919603518750,2:02,Kidney health is so important. This herbal kidney support ...,TikTok,holistichealthrobin
https://www.tiktok.com/@holistichealthrobin/video/7629150089574878495,0:49,I suffered with neuropathy for a while until I learned this. Nerve ...,TikTok,holistichealthrobin
https://www.tiktok.com/@holisticnaturalmom/video/7631661823258840351,0:12,perimenopause was about to take me out and I’m so glad ...,TikTok,holisticnaturalmom
https://www.tiktok.com/@holixtic/video/7203412622652362030,0:33,Essential Vitamins for Women Over 40: Boosting Health ...,TikTok,holixtic
https://www.tiktok.com/@hollandandbarrettmalta/video/7525082283888495894,0:23,New Wellness Supplements for Energy and Menopause Support,TikTok,hollandandbarrettmalta
https://www.tiktok.com/@honour.health/video/7288251469382290696,0:59,Best Practices for Taking Magnesium Glycinate Supplements,TikTok,honour.health
https://www.tiktok.com/@hormoneguru/video/7142282784420187434,1:41,#anxiety #anxieryrelief #anxietyanddepression #supplements ...,TikTok,hormoneguru
https://www.tiktok.com/@hormoneguru/video/7159698529173228842,1:26,Effective Supplements for Menopause Relief,TikTok,hormoneguru
https://www.tiktok.com/@husbands4menopause/video/7630618108184562958,1:39,"Husbands, the loss of hormones causing your wife to lose her ...",TikTok,husbands4menopause
https://www.tiktok.com/@iamjanuschan/video/7628874740286999828,1:49,Manage your menopause journey with Herbal Harmony by ...,TikTok,iamjanuschan
https://www.tiktok.com/@improvebgl/video/7633422853647387926,0:48,Discover this gentle Menopause shampoo for daily use. It ...,TikTok,improvebgl
https://www.tiktok.com/@imsimplynessa/video/7381610119139691806,0:53,Mary Ruth Vitamins Stomach Pain - Side Effects Revealed,TikTok,imsimplynessa
https://www.tiktok.com/@inspire_adventures/video/7623528541195423006,0:38,Perimenopause and menopause help. Meno Menopause ...,TikTok,inspire_adventures
https://www.tiktok.com/@ismabeauty19/video/7625315731114036493,0:43,Menopause Vitamin Capsules #MenopauseVitaminCapsules ...,TikTok,ismabeauty19
https://www.tiktok.com/@isomerskincare/video/7607903452949122312,0:34,Does Accutane cause hair loss? 😳 Yes — temporary shedding ...,TikTok,isomerskincare
https://www.tiktok.com/@itsajbabyy/video/7634353242511559949,0:27,Transform your home workouts with this Pilates Bar Kit with ...,TikTok,itsajbabyy
https://www.tiktok.com/@itsnursesam/video/7631294415851490582,1:48,Vitamin C is one of the most studied ingredients in skincare ...,TikTok,itsnursesam
https://www.tiktok.com/@itssodakbenny/video/7631661136785444109,1:29,Hormone balance support made simple 🌿 SNAP Perimeno ...,TikTok,itssodakbenny
https://www.tiktok.com/@itswalterhops/video/7600520767230463262,0:37,Non-Hormonal Menopause Support with FEM by UPSA,TikTok,itswalterhops
https://www.tiktok.com/@iv_drip_lounge/video/7628746320995437846,1:05,IV DRIP LOUNGE by Shar (@iv_drip_lounge)’s videos with ...,TikTok,iv_drip_lounge
https://www.tiktok.com/@iv_drip_lounge/video/7628932080914779414,0:14,IV VITAMIN DRIPS TAILORED FOR EACH PERSON ...,TikTok,iv_drip_lounge
https://www.tiktok.com/@j9naturally/video/7633461445518216469,0:54,Why Women Gain Belly Fat After Menopause Discover the ...,TikTok,j9naturally
https://www.tiktok.com/@j_lev68/video/7628062748575878430,0:17,We really went from feral childhood to “don’t text me after 9 ...,TikTok,j_lev68
https://www.tiktok.com/@jagannathanneurosurgery/video/7607959468751523085,0:06,"When we discuss menopause, the conversation usually ...",TikTok,jagannathanneurosurgery
https://www.tiktok.com/@janenemascarella/video/7610177736874773791,1:27,Revitalize Your Hair with Hair Growth Max Supplement,TikTok,janenemascarella
https://www.tiktok.com/@janenemascarella/video/7628071158910291230,1:02,I have been taking @Tropical Oasis Supplement Revive & ...,TikTok,janenemascarella
https://www.tiktok.com/@janenemascarella/video/7632270586047188254,2:00,"Women over 40, perimenopause, and menopause are not the ...",TikTok,janenemascarella
https://www.tiktok.com/@jannaluk_momo68/video/7628924436351061278,1:00,Joints Clicking? You Need These Nutrients#supplements ...,TikTok,jannaluk_momo68
https://www.tiktok.com/@jaydee_mn/video/7627277773278661918,0:41,Ferritin+ #ferritin #lowferritin #ironlevels #bloodwork ...,TikTok,jaydee_mn
https://www.tiktok.com/@jaynesharp/video/7558538408679771415,1:18,Perimenopause and Brain Fog: A Relatable Comedy,TikTok,jaynesharp
https://www.tiktok.com/@jayshetty/video/7545198098138664222,1:16,Understanding Menopause with Jay Shetty and Tamsen Fadal,TikTok,jayshetty
https://www.tiktok.com/@jenniferallmighty/video/7190764783237451050,2:12,Provitalize for Menopause: My Honest Review & Update,TikTok,jenniferallmighty
https://www.tiktok.com/@jennsfavefinds/video/7595759566927695134,0:21,Thirties are for THRIVING! ✨ @Nature Made #vitamins ...,TikTok,jennsfavefinds
https://www.tiktok.com/@jesse.korytko/video/7546030704052686101,0:51,5 Best Supplements for Menopause Relief,TikTok,jesse.korytko
https://www.tiktok.com/@jesse.korytko/video/7632119623168642324,0:45,"Comment ""guide"" #womenshealth ##fitover40 #menopause ...",TikTok,jesse.korytko
https://www.tiktok.com/@jeuneora/video/7605410439345851668,0:52,Discover Why Hormone Hero Sold Out: Support for ...,TikTok,jeuneora
https://www.tiktok.com/@jillianfeliceee/video/7467957106134601006,0:34,MENO vs URO: Which Supplement is Right for You?,TikTok,jillianfeliceee
https://www.tiktok.com/@jillianfeliceee/video/7478367156116131114,0:34,MENO vs URO: Understanding Their Unique Benefits,TikTok,jillianfeliceee
https://www.tiktok.com/@jimmyacusensei/video/7517783589040311583,1:38,Hot Flashes Relief: Using Clothespin for Menopause,TikTok,jimmyacusensei
https://www.tiktok.com/@jjonescrna/video/7630566865873505566,2:17,High Dose Vitamin C Infusion Update: Energy Boost & Cancer ...,TikTok,jjonescrna
https://www.tiktok.com/@jjsbeauties/video/7559215104252759326,1:09,Relief That Works: Slippery Kitty for Perimenopause,TikTok,jjsbeauties
https://www.tiktok.com/@jmomma_sahmlife/video/7632072178904648990,0:46,This perimenopause support formula from Snap Supplements ...,TikTok,jmomma_sahmlife
https://www.tiktok.com/@jodiejohnsononline/video/7606183376671739150,0:34,Revitalize Thinning Hair with The Rootist Densifying Serum,TikTok,jodiejohnsononline
https://www.tiktok.com/@jooijnn64/video/7627118949011967246,1:21,Vitamin B12 for Menopause: Boost Your Journey,TikTok,jooijnn64
https://www.tiktok.com/@jpt.rph/video/7528764121337154824,1:56,Vitamin E: Esensyal sa Skincare o Overhyped?,TikTok,jpt.rph
https://www.tiktok.com/@juanalabanana06/video/7630301796350594317,0:52,My child HATED vitamins until I found this. @MaryRuth's ...,TikTok,juanalabanana06
https://www.tiktok.com/@juliashantal/video/7267053994520939783,2:24,Pre Menopause Symptoms and Supplements for Women over ...,TikTok,juliashantal
https://www.tiktok.com/@justbeingmelani/video/7491853775930428715,1:46,Managing Perimenopause Symptoms with Natural Remedies,TikTok,justbeingmelani
https://www.tiktok.com/@justlikestosmile/video/7627187470244875551,2:58,"Perimenopause Diet Changes: Improved Thyroid, Iron & ...",TikTok,justlikestosmile
https://www.tiktok.com/@kalpana_chandra/video/7628248738783300885,1:04,Share to your loved ones ❤️ #vitaminD #vitamindeficiency ...,TikTok,kalpana_chandra
https://www.tiktok.com/@karammdskin/video/7628855727951465758,1:15,"Even as Dr. Karam’s wife, Neda thought she had the best ...",TikTok,karammdskin
https://www.tiktok.com/@karenellieth13/video/7516988598248377630,0:30,#menopause #menopausesupport #menopauserelief #peach ...,TikTok,karenellieth13
https://www.tiktok.com/@karentangmd/video/7630999100237925663,2:37,Can't get perimenopause/menopause HRT to keep us ...,TikTok,karentangmd
https://www.tiktok.com/@kari_wright/video/7606841715412012309,1:27,Body wide dryness in menopause & 7 related symptoms ...,TikTok,kari_wright
https://www.tiktok.com/@karolinafryzjer/video/7574820920372530434,0:15,Understanding Perimenopause and Women's Health ...,TikTok,karolinafryzjer
https://www.tiktok.com/@kate.gosselin/video/7632909203987844382,2:25,#livehighlights #tiktoklive Part 37 reposted with sound ...,TikTok,kate.gosselin
https://www.tiktok.com/@kategrosvenorlifecoach/video/7527404673658260758,2:27,Essential Perimenopause Supplements for Optimal Health,TikTok,kategrosvenorlifecoach
https://www.tiktok.com/@katieprice/video/7524417902057983254,1:16,Alivio para la premenopausia con suplementos naturales,TikTok,katieprice
https://www.tiktok.com/@kayleeislander/video/7632804917530463518,0:14,Hormone Support for Perimenopause & Menopause,TikTok,kayleeislander
https://www.tiktok.com/@keyforher/video/7326942352185019680,0:23,Key Peri & Menopause: Essential Supplements for Women,TikTok,keyforher
https://www.tiktok.com/@kikovitals/video/7630483399119047943,0:42,"Our second pillar, Nature (The Ingredients), is about working ...",TikTok,kikovitals
https://www.tiktok.com/@kittyqueenco/video/7631614323013602573,0:12,Happy kitties equals happy life. Come save your ...,TikTok,kittyqueenco
https://www.tiktok.com/@koerperkompass/video/7606708526760594710,1:40,#vitamin #vitamind #vitaminb12 #magnesium,TikTok,koerperkompass
https://www.tiktok.com/@komiwellness_/video/7538439728933145874,0:07,Manage Menopause Symptoms with Early Supplementation,TikTok,komiwellness_
https://www.tiktok.com/@komiwellness_/video/7549271476763921672,0:08,Effective Menopause Relief with Komi Wellness Supplements,TikTok,komiwellness_
https://www.tiktok.com/@komiwellness_/video/7549937495425781010,1:27,Komi Wellness: Natural Supplements for Women's Health,TikTok,komiwellness_
https://www.tiktok.com/@komiwellness_/video/7552167099557334280,0:44,Komi Wellness: Menopause Support Supplements for Women,TikTok,komiwellness_
https://www.tiktok.com/@komiwellness_/video/7552855752495467783,0:06,Komi Wellness Supplements: Empowering Women Through ...,TikTok,komiwellness_
https://www.tiktok.com/@komiwellness_/video/7571787698369842450,0:56,Natural Supplements for Thriving Through Menopause,TikTok,komiwellness_
https://www.tiktok.com/@komiwellness_/video/7591589225968012565,0:20,Manage Menopause Symptoms with Komi Wellness ...,TikTok,komiwellness_
https://www.tiktok.com/@komiwellness_/video/7600075731212946708,1:07,Benefits of Hydrolyzed Collagen and Vitamin C for Health,TikTok,komiwellness_
https://www.tiktok.com/@komiwellness_/video/7614589539847261460,0:10,Effective Menopause Relief with Komi Wellness Supplements,TikTok,komiwellness_
https://www.tiktok.com/@komiwellness_/video/7624110077133229332,2:43,"Every woman over 40 should take these 5 supplements, in ...",TikTok,komiwellness_
https://www.tiktok.com/@komiwellness_/video/7629322818852900117,0:08,Vaginal Steaming Myths Debunked: Supplements for Hormones,TikTok,komiwellness_
https://www.tiktok.com/@komiwellness_/video/7629711095724264724,0:11,"Menopause: What it is, even without symptoms",TikTok,komiwellness_
https://www.tiktok.com/@komiwellness_/video/7630920621806914837,1:03,Flush Fibroids with Fibre: Reduce Excess Estrogen & Pain,TikTok,komiwellness_
https://www.tiktok.com/@komiwellness_/video/7631246457986764052,0:30,"What was your first symptom of perimenopause , ladies? Let’s ...",TikTok,komiwellness_
https://www.tiktok.com/@komiwellness_/video/7631285238689303829,0:10,Restore Your Period with Komi Wellness Supplements,TikTok,komiwellness_
https://www.tiktok.com/@komiwellness_/video/7632640022021147925,0:15,You don’t need to tolerate Menopause Symptoms that make ...,TikTok,komiwellness_
https://www.tiktok.com/@kristinrottman/video/7631347992137633037,0:36,pov: you found the best supplement for supporting your dogs ...,TikTok,kristinrottman
https://www.tiktok.com/@kuganesri/video/7099837184122866971?lang=bg,0:23,#menopause #perimenopause #blackcohosh ...,TikTok,kuganesri
https://www.tiktok.com/@ladycj_ttshopcreator/video/7589696685807324438,0:10,Kind Patches Menopause Patches for Daily Comfort,TikTok,ladycj_ttshopcreator
https://www.tiktok.com/@ladywarriorshannon/video/7629546547142757663,0:08,Don’t sleep on the non-negotiable #perimenopaue ...,TikTok,ladywarriorshannon
https://www.tiktok.com/@landyschemist/video/7272725561418566945,0:09,Starflower Oil: Relieve Menopause Symptoms Naturally,TikTok,landyschemist
https://www.tiktok.com/@landyschemist/video/7312114751578869024,0:08,Take Vitamin B6 for Menopause Relief and Mood Support,TikTok,landyschemist
https://www.tiktok.com/@landyschemist/video/7328557762055572768,0:40,Best Supplements for Menopause and Perimenopause ...,TikTok,landyschemist
https://www.tiktok.com/@lauraposadalifestyle/video/7629102286052019486,1:32,#lauraposada #lauraposadasupplements ...,TikTok,lauraposadalifestyle
https://www.tiktok.com/@leannettsdeals/video/7630543562131688726,0:24,Pixar fans wow wow wow!,TikTok,leannettsdeals
https://www.tiktok.com/@leeleeskincareenterprise/video/7627150957079792917,1:49,Sadoer Collagen Anti-Aging Body Lotion Review & Benefits,TikTok,leeleeskincareenterprise
https://www.tiktok.com/@leminetree/video/7626694013277621524,1:23,Saucy Tenderised Steak with Garlic Mash Recipe,TikTok,leminetree
https://www.tiktok.com/@leniealexisdesigns/video/7538325511596985655,0:31,Black Girl Vitamins now carries Meno Chill for those ofnus ...,TikTok,leniealexisdesigns
https://www.tiktok.com/@leniealexisdesigns/video/7541771529219050766,0:39,Support Menopause Symptoms with Meno-Chill Vitamins,TikTok,leniealexisdesigns
https://www.tiktok.com/@lifeaskim54/video/7632426811338575107,0:08,Natural alternatives for perimenopause focus on lifestyle ...,TikTok,lifeaskim54
https://www.tiktok.com/@lifeofkeli/video/7631718146331692319,0:05,You don’t have to suffer with menopause symptoms ladies ...,TikTok,lifeofkeli
https://www.tiktok.com/@lifestyle_and_smiles/video/7345417513418706209,2:28,Essential Vitamin D3 with K2 for Perimenopause Wellness,TikTok,lifestyle_and_smiles
https://www.tiktok.com/@lifestyle_and_smiles/video/7616823208225901846,2:40,Vitamins and Supplements for Perimenopause Health,TikTok,lifestyle_and_smiles
https://www.tiktok.com/@lifey333/video/7631713087451680013,0:25,Magnetic Phone holder discreet way to record Portable phone ...,TikTok,lifey333
https://www.tiktok.com/@lila.menopause.su/video/7631657525112327438,0:06,Feeling like your body’s betraying you in your 40s? 😩 Start ...,TikTok,lila.menopause.su
https://www.tiktok.com/@lila.over40/video/7628352420581592342,0:06,Perimenopause Relief: Supplements That Changed ...,TikTok,lila.over40
https://www.tiktok.com/@liliamartinez0903/video/7629146523720322317,0:15,Thorne Supplements: Women's Health & Longevity,TikTok,liliamartinez0903
https://www.tiktok.com/@lillianwangui_/video/7628148218068634901,1:21,Here we respond to some of the most asked questions about ...,TikTok,lillianwangui_
https://www.tiktok.com/@linda.healthcoach/video/7626940541531409694,1:16,Hormone Balance Supplements for Perimenopause,TikTok,linda.healthcoach
https://www.tiktok.com/@lipglossandcars/video/7364116457459895595,1:43,Meno Menopause Vitamins by O Positiv Health on the TikTok ...,TikTok,lipglossandcars
https://www.tiktok.com/@lisanathan742/video/7607802992607218966,1:05,#cleantok #tiktokmademebuylt #fyp,TikTok,lisanathan742
https://www.tiktok.com/@liz_the_clearancequeen/video/7630660938420505870,0:52,Who has time to waste???! I want my hot towel NOW ...,TikTok,liz_the_clearancequeen
https://www.tiktok.com/@lo_stein/video/7628206751090871566,1:21,Replying to @Peo Ketsitlile #science #womenshealth #obgyn ...,TikTok,lo_stein
https://www.tiktok.com/@lollilife73/video/7629134518175239437,0:06,Menopause Symptoms & Tips for Over 50,TikTok,lollilife73
https://www.tiktok.com/@londonsuperclinic/video/7337703911228214561,0:50,Essential Supplements for Over 40s: Boost Your Health,TikTok,londonsuperclinic
https://www.tiktok.com/@londonsuperclinic/video/7366687989944143136,0:20,Essential Supplements to Boost Immune System Health,TikTok,londonsuperclinic
https://www.tiktok.com/@londonsuperclinic/video/7372688228085730593,1:42,"Understanding Menopause: Effects on Vitamin D, Cholesterol ...",TikTok,londonsuperclinic
https://www.tiktok.com/@londonsuperclinic/video/7406009176578673953,0:57,Top 3 Supplements for Menopause Relief,TikTok,londonsuperclinic
https://www.tiktok.com/@lorelei_bachman/video/7625816284256652552,1:11,#women #iron #supplement #vitamin #menopause @Spatone ...,TikTok,lorelei_bachman
https://www.tiktok.com/@lottieryantiktok/video/7554093266371644694,1:35,Understanding Perimenopause: Support for Women's Health,TikTok,lottieryantiktok
https://www.tiktok.com/@lovedbyheather/video/7591230898704485646,0:27,Affordable Beef Organ Supplements for Menopause Relief,TikTok,lovedbyheather
https://www.tiktok.com/@lovemushroomsuk/video/7630382303814012163,0:18,"it's been a week, so many people spoken to and sampled ...",TikTok,lovemushroomsuk
https://www.tiktok.com/@lovewellness/video/7432097940258180394,0:43,Gummy Probiotics: The Truth About Vaginal Health,TikTok,lovewellness
https://www.tiktok.com/@lucyhallett_/video/7632009873919610134,0:36,"Perimenopause: Periods, Clots, and Symptoms Explained",TikTok,lucyhallett_
https://www.tiktok.com/@lucyhallett_/video/7633010517682015510,0:57,Understanding Perimenopause and Menopause Symptoms,TikTok,lucyhallett_
https://www.tiktok.com/@lylhealth/video/7621981003380280590,0:16,Menopause Support with Physician's Choice,TikTok,lylhealth
https://www.tiktok.com/@lyvonnecopeland/video/7628027583568825613,0:27,Menopausal girlies we have to have our vitamin game on ...,TikTok,lyvonnecopeland
https://www.tiktok.com/@lyvonnecopeland/video/7630174694573952270,0:16,#menopause #perimenopause #bigdreamsstartsmall ...,TikTok,lyvonnecopeland
https://www.tiktok.com/@madamkidney_bfb/video/7461161151364074758,0:54,Types of Wellwoman Supplements for Women’s Health,TikTok,madamkidney_bfb
https://www.tiktok.com/@madamkidney_bfb/video/7488440894794796343,0:15,Wellwoman Supplements for Women Over 40: Benefits ...,TikTok,madamkidney_bfb
https://www.tiktok.com/@madamkidney_bfb/video/7628252728447356180,0:10,We are doing smart supplements: Safer kidneys ...,TikTok,madamkidney_bfb
https://www.tiktok.com/@magnoliapharmacy/video/7408526822071242030,1:24,"If you have menopause, here is a complete list of vitamins and ...",TikTok,magnoliapharmacy
https://www.tiktok.com/@magnoliapharmacy/video/7424481459689262379,1:46,Best Supplements for Women Over 40: Enhance Your Health ...,TikTok,magnoliapharmacy
https://www.tiktok.com/@magnoliapharmacy/video/7460114306244513070,1:56,Lower excess estrogen levels with these supplements and ...,TikTok,magnoliapharmacy
https://www.tiktok.com/@magnoliapharmacy/video/7480896241753181486,1:49,Women over 40 you can use these 5 supplements for a true ...,TikTok,magnoliapharmacy
https://www.tiktok.com/@magnoliapharmacy/video/7498320057471094059,1:32,Effects of Estrogen Supplementation Over Three Months,TikTok,magnoliapharmacy
https://www.tiktok.com/@magnoliapharmacy/video/7521340450221919501,2:06,✨Menopause Supplement Cheat Sheet✨ Struggling with ...,TikTok,magnoliapharmacy
https://www.tiktok.com/@magnoliapharmacy/video/7604708278412627213,2:17,Menopause symptoms aren’t random—and they’re not just ...,TikTok,magnoliapharmacy
https://www.tiktok.com/@magnoliapharmacy/video/7627907409444359437,0:40,Creatine ruins your kidneys. That’s what people believe ...,TikTok,magnoliapharmacy
https://www.tiktok.com/@magnoliapharmacy/video/7628574018223738125,1:34,Not all hormone therapy is created equal. 😤 The difference ...,TikTok,magnoliapharmacy
https://www.tiktok.com/@maiphephi0/video/7626346578722245909,0:59,Mai Fish Pride - Menopause Gang,TikTok,maiphephi0
https://www.tiktok.com/@mamadawnny/video/7598583709482110221,0:32,The menopausal survival bundle! 3 vitamins we need during ...,TikTok,mamadawnny
https://www.tiktok.com/@manishayournutritionist/video/7186390278289247494,1:55,3 Essential Supplements for Menopause,TikTok,manishayournutritionist
https://www.tiktok.com/@manishayournutritionist/video/7194911571217255685,1:47,Supplements for Perimenopause and Menopause Support,TikTok,manishayournutritionist
https://www.tiktok.com/@manishayournutritionist/video/7333636172184341793,2:45,HRT Alternatives: Natural Ways to Manage Menopause,TikTok,manishayournutritionist
https://www.tiktok.com/@manishayournutritionist/video/7459510836722142496,1:07,Magnesium Supplements for Women Over 40,TikTok,manishayournutritionist
https://www.tiktok.com/@marcellam55/video/7604550212874407190,2:20,Menopause Relief: Natural Supplements for Wellness,TikTok,marcellam55
https://www.tiktok.com/@mariabonehealthcoach/video/7632434432825199894,0:28,what supplements to take if 50 plus and post menopause! the ...,TikTok,mariabonehealthcoach
https://www.tiktok.com/@mariamenounos/video/7632061715772984606,0:43,Had to bring this clip with Justin Bieber back now that ...,TikTok,mariamenounos
https://www.tiktok.com/@mariannas_pantry/video/7288018843392412958,1:32,Do all vitamins need to be taken with food? Also reminder ...,TikTok,mariannas_pantry
https://www.tiktok.com/@maribelherreraa/video/7607921007898217759,1:04,Multivitaminas Esenciales para Mujeres en Menopausia,TikTok,maribelherreraa
https://www.tiktok.com/@maribelherreraa/video/7612893440598199582,0:59,Multivitaminas #multivitaminas #multivitamin #mujeres ...,TikTok,maribelherreraa
https://www.tiktok.com/@marielkliatchko/video/7418501653415890194,1:21,Magandang Vitamins sa Menopause: Ano ang Dapat Alamin?,TikTok,marielkliatchko
https://www.tiktok.com/@marisolbeauty/video/7505394529491799342,0:56,Effective Vitamins for Long Hair Growth,TikTok,marisolbeauty
https://www.tiktok.com/@marlene.escatel/video/7554245973506067743,0:31,GNC Women’s 50+ Vitapak: A Simple Daily Routine,TikTok,marlene.escatel
https://www.tiktok.com/@marlene.escatel/video/7555929380950773022,0:30,GNC Women's 50+ Vitapak: A Thoughtful Gift for Moms,TikTok,marlene.escatel
https://www.tiktok.com/@meaganonline/video/7236135655837814062,2:03,Hormone replacement therapy for menopause. Lets demystify ...,TikTok,meaganonline
https://www.tiktok.com/@meagherspharmacy/video/7485847976254917910,1:04,Menopause Supplements for Symptom Relief and Support,TikTok,meagherspharmacy
https://www.tiktok.com/@medi_caldairy/video/7480969394726767894,0:09,Understanding Vitamins and Their Chemical Names,TikTok,medi_caldairy
https://www.tiktok.com/@medicalhealthlife/video/7632179440604269842,1:41,Noera bisa jadi opsi suplemen untuk membantu wanita pre ...,TikTok,medicalhealthlife
https://www.tiktok.com/@medvaultrx/video/7634158294935850270,2:15,#learnontiktok #menopause #antiagingtips #estrogen ...,TikTok,medvaultrx
https://www.tiktok.com/@melissasfinds86/video/7616738924815322390,0:12,Menopause support supplement bundle This women’s ...,TikTok,melissasfinds86
https://www.tiktok.com/@melrobbins/video/7620502550436924703,2:15,Menopause Symptoms: Vaginal Estrogen for Relief | Mel ...,TikTok,melrobbins
https://www.tiktok.com/@menopause.nurse/video/7629500458247179533,0:09,Fix Your Gut for Menopause Weight Loss & Hormone Balance,TikTok,menopause.nurse
https://www.tiktok.com/@menopause.nurse/video/7630443120307506446,0:08,No More Stiffness: How This Collagen Changed My Mornings,TikTok,menopause.nurse
